{
  "schema": 1,
  "name": "Acme Corp",
  "slug": "acme-corp",
  "aliases": [],
  "website": "",
  "size": "",
  "type": "unknown",
  "big_tech": false,
  "email_match": [],
  "recruiter": {
    "name": "",
    "email": ""
  },
  "sponsor": {
    "status": "unknown",
    "evidence": [],
    "last_checked": ""
  },
  "custom": {}
}
